{
  "side": "OPFOR",
  "name": "Soviet Army 1980s",
  "roles": [
    {
      "role": "Squad Leader",
      "character": "{DCB41B3746FDD1BE}Prefabs/Characters/Factions/OPFOR/USSR_Army/Character_USSR_Rifleman.et",
      "loadout": {
        "version": 2,
        "wear": {
          "headCover": null,
          "jacket": "{9F546CCA2582D16F}Prefabs/Characters/Uniforms/Jacket_M88.et",
          "pants": "{DCF980831E880F6A}Prefabs/Characters/Uniforms/Pants_M88.et",
          "boots": null,
          "vest": "{9713FE6DDCC9510D}Prefabs/Characters/Vests/Vest_Lifchik/Vest_Lifchik.et",
          "armoredVest": "{ADE19B33DCBB9005}Prefabs/Characters/Vests/Vest_6B2/Vest_6B2.et",
          "backpack": null,
          "handwear": null
        },
        "weapons": [
          {
            "slotIndex": 0,
            "slotType": "primary",
            "weapon": "{FA5C25BF66A53DCF}Prefabs/Weapons/Rifles/AK74/Rifle_AK74.et",
            "optic": null,
            "magazine": null,
            "attachments": []
          },
          {
            "slotIndex": 3,
            "slotType": "grenade",
            "weapon": "{645C73791ECA1698}Prefabs/Weapons/Grenades/Grenade_RGD5.et"
          }
        ],
        "summary": "AK-74 · RGD-5"
      }
    },
    {
      "role": "Rifleman",
      "tag": "AT",
      "character": "{DCB41B3746FDD1BE}Prefabs/Characters/Factions/OPFOR/USSR_Army/Character_USSR_Rifleman.et"
    }
  ],
  "vehicles": [
    {
      "vehicle": "{259EE7B78C51B624}Prefabs/Vehicles/Wheeled/UAZ469/UAZ469.et",
      "label": "UAZ-469"
    }
  ]
}
